{
  "id": "AC-001",
  "requirement": "主要驗證命令成功且沒有未揭露的 failed 或 skipped test。",
  "validation_method": "獨立執行 Repository acceptance command。",
  "required_evidence": ["command", "exit_code", "passed", "failed", "skipped", "evidence_path"],
  "owner": "workers_qa",
  "status": "NOT_VERIFIED",
  "evidence": [],
  "verdict": null
}
